<Book xmlns:xsi="http://www.w3.org/2001/XMLSchema-instance"
      xmlns="http://xml.tinh.com/schema/extending"
      xsi:schemaLocation="http://xml.tinh.com/schema/extending extending.xsd">
    <Title>How about sword ??</Title>
    <Author Title="Mr." BirthYear="1982">
        <FirstName>Ha</FirstName>
        <MiddleName>Ka</MiddleName>
        <LastName>La</LastName>
        <Speciality>Childrens</Speciality>
    </Author>
    <Illustrator Title="Ms." BirthYear="1990">
        <FirstName>Ho</FirstName>
        <MiddleName>A</MiddleName>
        <LastName>Xas</LastName>
    </Illustrator>
</Book>